{"assets":[{"path":"assets/9999999999999999999999999999999999999999999999999999999999999999.png","sha256":"9999999999999999999999999999999999999999999999999999999999999999","size":16,"source_path":"pkg-boke/assets/boke.png"},{"path":"assets/aaaaaaaaaaaaaaaaaaaaaaaaaaaaaaaaaaaaaaaaaaaaaaaaaaaaaaaaaaaaaaaa.png","sha256":"aaaaaaaaaaaaaaaaaaaaaaaaaaaaaaaaaaaaaaaaaaaaaaaaaaaaaaaaaaaaaaaa","size":20,"source_path":"pkg-tsukkomi/assets/tsukkomi.png"}],"duration_ms":1000,"files":[{"path":"assets/9999999999999999999999999999999999999999999999999999999999999999.png","sha256":"9999999999999999999999999999999999999999999999999999999999999999","size":16},{"path":"assets/aaaaaaaaaaaaaaaaaaaaaaaaaaaaaaaaaaaaaaaaaaaaaaaaaaaaaaaaaaaaaaaa.png","sha256":"aaaaaaaaaaaaaaaaaaaaaaaaaaaaaaaaaaaaaaaaaaaaaaaaaaaaaaaaaaaaaaaa","size":20},{"path":"index.html","sha256":"bbbbbbbbbbbbbbbbbbbbbbbbbbbbbbbbbbbbbbbbbbbbbbbbbbbbbbbbbbbbbbbb","size":100},{"path":"player.js","sha256":"cccccccccccccccccccccccccccccccccccccccccccccccccccccccccccccccc","size":100},{"path":"style.css","sha256":"dddddddddddddddddddddddddddddddddddddddddddddddddddddddddddddddd","size":100}],"height":720,"id":"paper-theater-preview-3b69ea1ed3c5ba72c625","intent":"evaluation","kind":"paper-theater-preview","roles":{"boke":{"character_ref":"character-boke","license_status":"reviewing","package_id":"variant-export-package-33333333333333333333","package_manifest_sha256":"4444444444444444444444444444444444444444444444444444444444444444","stage_slot":"left","variant_set_ref":"variant-set-55555555555555555555"},"tsukkomi":{"character_ref":"character-tsukkomi","license_status":"reviewing","package_id":"variant-export-package-66666666666666666666","package_manifest_sha256":"7777777777777777777777777777777777777777777777777777777777777777","stage_slot":"right","variant_set_ref":"variant-set-88888888888888888888"}},"scene_plan_path":"scene-plan.json","scene_plan_ref":"paper-theater-scene-plan-11111111111111111111","scene_plan_sha256":"2222222222222222222222222222222222222222222222222222222222222222","schema_version":"1.0","segments":[{"boke":{"asset_path":"assets/9999999999999999999999999999999999999999999999999999999999999999.png","key":"boke.neutral","png_sha256":"9999999999999999999999999999999999999999999999999999999999999999","variant_id":"variant-boke"},"end_ms":1000,"stage_slots":{"boke":"left","tsukkomi":"right"},"start_ms":0,"tsukkomi":{"asset_path":"assets/aaaaaaaaaaaaaaaaaaaaaaaaaaaaaaaaaaaaaaaaaaaaaaaaaaaaaaaaaaaaaaaa.png","key":"tsukkomi.neutral","png_sha256":"aaaaaaaaaaaaaaaaaaaaaaaaaaaaaaaaaaaaaaaaaaaaaaaaaaaaaaaaaaaaaaaa","variant_id":"variant-tsukkomi"}}],"width":1280}
